movie_id,title,plot,language,genre
1810967,Dead End,"The true story of 4 men found dead in an apartment in new jersey and how years later a video tape was discovered in new york city solved this brutal crime...the tape, found in a video camera in a pawn shop, cleared the names of the suspected killers.",English,Crime
2203627,Pink Floyd The Wall,"The life of the fictional rock star 'Pink' is the subject of the visually evocative cult film based upon the music and visions of the group Pink Floyd as portrayed in the album of the same title. Relationships, drug abuse, sex, childhood, WWII and fascism combine in a disturbing mix of episodic live action and lyrical animation drawn by British caricaturist Gerald Scarfe.",English,Drama
2261725,Santa's Slay,"Bill Goldberg plays the devil's son who lost a wager with a angel and was forced to spend 1000 years playing Santa, but now the wager of that time has run out, and good old Santa isn't so joyful anymore. He makes up for lost time and starts to kill people.",English,Comedy
1816866,Dentally Does It,"A short film which centres around a Dentist (Paul) his wife (Kate) and the Dentist's old school friend (Jack). Paul and Jack never really got on, they used to just tollerate each other. Jack's a womanising estate agent who doesn't have much time for other people, Paul's an upstanding Dentist with a lovely wife; but just how much does Paul know? \Dentally Does It\"" is a black comedy with a twist in the tail.""",English,Comedy
2315729,"Stranger Than Fiction, #69","This short opens featuring a 19-year-old boy who is seven feet three inches tall and a cadet at a military college. It then jumps to the bizarre and oddly-constructed home of Bouck White, a Harvard grad, whose castle home in upstate New York is a patchwork of masonry without any rhyme or reason. Then Koroseal, a rubber-like substance made from limestone, coke and salt is examined, and the audience learns that the material can be made into dresses and beach-wear, and has unlimited possibilities. A rooster who jumps for corn kernels and molds that make weird faces in pumpkins winds up the one-reeler.",English,Short
2370318,The Fort,"As Darcy is chased around her production office by actors, production crew and her mentor, she is forced to try to explain 'The Story' that is she is trying to tell. But she is unable to distill the essence of an ever-expanding, bloated narrative. This throws her into an existential crisis.",English,Comedy
2180347,Orphans' Picnic,"Mickey and Donald take a truckload of mouse boys on a picnic. The boys delight in tormenting Donald, first by filching the picnic food, then giving him a flower with a bee inside (Donald eventually gets the whole hive after him), and finally a sandwich with another bee in it.",English,Animation
1838820,Dollhouse,"A little girl inherits a special dollhouse upon her grandmother's passing. Unfortunately, the grandmother's dislike for her daughter-in-law becomes apparent after the dollhouse enters their home. Mysterious tensions rise quickly as the mother is taunted and hunted by the grandmother from beyond.",English,Short
2261279,Sanna ögonblick,"By chance Erik meets Viivi, an Estonian violinist playing in the Stockholm subway. They start an intense romance. Erik's mother dislikes the relationship, not having forgotten her escape from Estonia during the war. She reveals facts from the past and Erik finds out that his Swedish father adopted him. His real father was an Estonian nazi. Viivi has grown up in communist Estonia where her father was a party member and worked for the KGB. Upset by Erik's mothers reaction Viivi returns to Estonia. Erik decides to follow and learn more about his real father and his Estonian family. Erik and Viivi's love is put to the test when they meet again. Their fathers were childhood friends, but fought on opposite sides in the war. Will the past destroy the future of Erik and Viivi?",Swedish,Drama
1808704,Days of Being Wrinkle Free,"Captain is stuck in a laundromat of broken dreams. Dumped by his long-time girlfriend, it seems his world is changing faster than he can bear. For Captain, laundry is the best of therapy. Through 101 laundromat metaphors, he comes to understand and embrace the true nature of change.",Mandarin,Drama
2098583,Malika,Malika lives in the Nairobi slums and longs to go to school. Her mother is dead and father has disappeared. The child and her sick grandmother are supported by her aunt who works long hours to pay for her family's needs but cannot afford Malika's education. A sympathetic school teacher arranges a bursary for the girl at the local school but as the Grandmother is dependent on Malika to take care of her she cannot take up the offer. Then Granny dies and Malika is suddenly free of her responsibilities. But the arrival of a new young cousin puts paid to the child's hope of freedom as she has to take on the role of nursemaid so her aunt can continue to work...,Swahili,Drama
1899217,Formosa Betrayed,"In the early 1980s, an FBI Agent is assigned to investigate the murder of a respected professor. Through his investigation, he unearths a spider web of international secrets that has been thriving within college campuses across America for decades. His investigation takes him across the Pacific to the island nation of Taiwan, where with the help of the outspoken widow and an unlikely spy, he learns that the Professor's killing was not a random act, but a desperate move by a scandalous government intent on keeping its nefarious activities under wraps. Our detective soon finds himself on a collision course against the U.S. State Department, the Chinese Mafia, and the Nationalist Chinese Government - in a land where the truth is not what it seems and the only people he can trust, cannot be trusted at all. Inspired by actual events.",English,Thriller
2469617,Up in the Air,"A none-too-popular (nor good) radio singer, Rita Wilson is murdered while singing on the air in a radio studio. Radio page boy, Frankie Ryan, and his janitor pal, Jeff, solve the mystery for the none-too-sharp police.",English,Action
2151167,New Low,"The worst thing about Wendell (Adam Bowers) isn't his slightly balding head, skinny frame, or thin lips; it's that he's a bit of an idiot. He just started dating Vicky (Jayme Ratzer), an angry drunk, who conveniently shares his lack of ambition and cleanliness. But he might prefer a relationship with Joanna (Valerie Jones) because she's a selfless social worker who doesn't have lip acne. Eventually, Wendell is going to have to decide who he really belongs with: the best girl he's ever known-or the worst.",English,Comedy
2180077,Original falsifikata,"The plot lasts from 1945 until today's day. Pavle, Stojan and Dragisa, the three war friends are taking different positions within the society immediately after the war. Pavle, a former war commissar, is now a school teacher. Thanks to him, Stojan, who was a bakery assistant before the war, does the job of a district committee's secretary, while Dragisa works in the state's secret police. The reason of conflict between Pavle and Stojan in 1947 was Stojan's fiancée Lena, who loves Pavle, marries him and gets pregnant, right when Pavle is taken to the state prison. Stojan accepts his wife and kid again, but the avalanche of political events will make all them unable to stop the inevitable catastrophe.",Serbo-Croatian,Drama
1877344,Evropolis - gradyt na deltata,"In 1933 Eugeniu Botez, an engineer by profession and a commandant of the harbour of Sulina, wrote a novel. He entitled it 'Europolis' and signed it under the name of Jean Bart. A year later he died. In this strange novel Jean Bart prophecies that one day nothing will be left from the town, once full of life. With the death of Europolis Europe will be slowly dying in pains. A few years later his prophecy started to come true.",Romanian,Documentary
1667283,Aesop's Fable: Happy Valley,"A young boy asks an old man why the valley they live in is such a beautiful utopia and is called Happy Valley, and the old man explains it is because everyone there is contented and happy but, he adds, it wasn't always that way. In a flashback, he tells the boy that many years ago this paradise was nearly wrecked when greed swept over the land, and this led to poverty and misery before all the farmers came to their senses. Sounds like a film that should have been investigated by the HUAC committee.",English,Animation
2341075,That Riviera Touch,"After a mix-up with a member of the Royal Family, traffic wardens Eric and Ernie decide to take a holiday to the South Of France. However, when they arrive there, they find themselves caught up in the plot of Le Pirate who has stolen a collection of valuable jewels and plans to use Eric and Ernie to smuggle the collection out of France. He lures them to an old villa filled with traps and uses Claudette, another member of the gang, to keep Eric and Ernie busy. However, other jewel thieves are after the jewels and Eric continues to find their bodies in the villa just before it disappears. However, while they fight over the love of Claudette, Eric and Ernie begin to wonder just what is going on, and begin to investigate. As to Claudette, whose side is she on...?",English,Comedy
2101185,Manji,"Manji's car hire and repair business is failing and matters are made worse when his son, Raj walks out. Manji resorts to sleeping on the premises rather than face going home. He retreats into a Bollywood world of dance and happier times with his wife, Rambai with whom he built the business. In a long dark night of the soul, Manji comes to terms with Rambai's death. She was killed in a car crash which he survived. Manji smashes up the garage which he holds so dear because it contains too many memories.",English,Short
2031340,L'amante perduto,"Siamo a Tel Aviv, in una famiglia ebrea. Asya si è chiusa in se stessa dopo la morte del figlio, avvenuta per un incidente d'auto anni addietro. Adam, il marito, gestisce un'autofficina e la ama teneramente, ma non riesce a spezzare la cortina di silenzio che si è creata fra i due. La loro figlia Dafi è un'adolescente inquieta e ribelle che continua ad interrogarsi sul rapporto tra i genitori. Un giorno arriva al garage una vecchia Morris da riparare, di proprietà di Gabriel, arrivato da Parigi per prendere possesso dell'eredità della nonna, in coma. Tra Asya e Gabriel nasce un rapporto indefinito ( sono veramente amanti, come pensa Adam, o si tratta del bisogno quasi materno di una donna per un ragazzo solo ed un pò strano ?). Dopo un pò Gabriel sparisce, convocato per il servizio militare. Asya sprofonda in un acuto mutismo e Adam, sempre più innamorato della moglie, decide di mettersi alla ricerca del giovane. Nel frattempo viene assunto al garage un ragazzino palestinese, fratello di un terrorista da poco ucciso durante un attentato, con cui Dafi intreccia la sua prima, vera e quasi impossibile storia d'amore. Alla fine Gabriel viene ritrovato, cambiato del tutto : è diventato rabbino, pur senza troppa convinzione, per sfuggire alle azioni militari in Libano. Asya si rende conto che la sua era forse solo infatuazione o bisogno di maternità e cerca, insieme al marito, di far tornare il giovane a Parigi. I due coniugi, probabilmente, torneranno ad comprendersi e ad amarsi.",English,Drama
1806934,Das tapfere Schneiderlein,"After killing seven flies with one blow, the Tailor sews himself a decorative belt, which advertises his achievement. However, he is intentionally vague about what exactly he killed; in fact, he lets the King assume that he is a strong and experienced fighter, in order to marry the Princess. The king says the Tailor must first capture a unicorn, then a wild boar, and finally a giant. And the Brave Little Tailor agrees, relying on his wits. Will he succeed? And will he win the princess' hand in marriage?",German,Animation
1938113,Hardcore,Jake Van Dorn is a businessman from the American heartland who shares strong Calvinist convictions with most of his countrymen. His teenage daughter is missing from her church youth convention trip to California and Van Dorn hires a private investigator to find her. The result of the investigation is his daughter is spotted in a cheap X-rated movie. Van Dorn decides to bring her back personally and during the quest he becomes familiar with the pornographic underworld.,English,Drama
1652049,A Long Way from Home,"Joseph and Brenda have done what many only dream of and retired to the South of France to live out the rest of their days as if they were permanently on holiday. But retirement is not what Joseph imagined, and when he meets a young, attractive woman, Suzanne, everything he thought he knew about himself and his world is turned upside down.",English,Drama
2265052,Scarecrow,"The Scarecrow explores the decay of land and identity, themes of isolation and paranoia. Set on a desolate farm, a lonely farmer decides to get rid of a tatty old scarecrow; viewable every morning from the window in his bleak bedroom. However, after waking up the next day to find the scarecrow back in the field, events take a turn for the worse, and the farmer's actions become increasingly frantic. Doubting his own mind, the farmer begins to wonder if there is a hidden connection between himself and the old, decrepit scarecrow...",English,Thriller
2056183,Law of the Wolf,"Carl Pearson has been wrongly convicted of killing his brother. With the help of another convict, he breaks out of prison to try to clear his name and to try to find some valuable plans left behind by his dead brother. But Pearson is being pursued both by the police and by the actual killer.",English,Crime
2026446,Kozure Ôkami: Sanzu no kawa no ubaguruma,"In the second film of the Lone Wolf and Cub series, Ogami Itto battles a group of female ninja in the employ of the Yagyu clan and must assassinate a traitor who plans to sell his clan's secrets to the Shogunate.",Japanese,Action
2246486,Roast-Beef and Movies,"Three good-for-nothings overhear a movie producer and his partners offering a grand sum if someone will present him with a sure-fire movie idea. The leader of the three dopes, Gus Parkyakarkus, barges into the meeting with his cohorts and proceeds to rattle off spiels for several inane prospective movies. The three are delighted to be told they've made a sale, but the producers turn out to have a surprise in store.",English,Comedy
2419060,The Tenderfoot's Money,"The tenderfoot came into camp with his ill-gotten money intending to purchase a claim. The faker salted a claim, hoping thereby to secure the money. But the gambler got ahead of him through cheating at cards. Later the tenderfoot sought to regain his money and in the struggle it fell into worthier hands.",English,Short
1762169,Cashback,"When art student Ben Willis dumps his girlfriend Suzy, he develops chronic insomnia after finding out how quickly she moved on. To pass the long hours of the night, he starts working the late night shift at the local supermarket. There he meets a colorful cast of characters, all of whom have their own 'art' in dealing with the boredom of an eight-hour-shift. Ben's art is that he imagines himself stopping time. This way, he can appreciate the artistic beauty of the frozen world and the people inside it - especially Sharon, the pretty and quiet checkout girl, who perhaps holds the answer to solving the problem of Ben's insomnia.",English,Comedy
1756345,Calling All Tars,"This early comedy short has Bob Hope and John Berkes putting on sailor uniforms to find dates, getting mistaken for real sailors and being dragged back to a Navy ship by the shore patrol. Though not much plot, the short does give each star a chance to shine doing comedy bits both together and separately.",English,Comedy
2293812,Slice,"Anthony Leone is a successful Writer/Director of the Movie \Goomba Goons\"" and the Studio that made this happen wants him to Direct \""Goomba Goons II\"". Anthony does not want to be stuck with the Mobster stereotype and instead wants to make a small movie with big heart about Italian families in Brooklyn and his Grandpa's Pizzaria. The studio head changes his mind and says yes to Anthony's Little Brooklyn movie after eating Anthony's Dad's (Carmine Leone) Cheesecake.""",English,Comedy
1927670,Great Guns,"Laurel and Hardy work for sickly heir Dan Forrester, who has been diagnosed with a myriad of debilitating allergies. However, when the draft board sees things differently and he seems very happy to leave the confines of his sick room, his loyal employees join him in the U. S. Army. He seems to thrive on Army chow and regimen and even becomes a rival to the growling Sergeant Hippo for the affections of beautiful post employee Ginger Hammond . The bumbling Stan and Ollie also get a chance to redeem themselves when they participate in the all-important war game maneuvers.",English,Comedy
2380884,The Invaders,"The U.S. Army and the Indians sign a peace treaty. However, a group of surveyors trespass on the Indians' land and violate the treaty. The army refuses to listen to the Indians' complaints, and the surveyors are killed by the Indians. A vicious Indian war ensues, culminating in an Indian attack on an army fort.",English,Short
1984630,Inja,"In South Africa, not long before apartheid ends, a Xhosa lad of about 12, Thembile, gets a new puppy. They're quickly fast friends, until the White landowner sets up an incident of cruelty to the dog that Thembile realizes will turn the dog against him. Jump ahead ten years, Thembile is a strapping young man, the dog is full grown, and the boss is aging. The three of them go off to mend some fencing. When a problem arises, chickens come home to roost.",Afrikaans,Drama
2042760,La madrina del diablo,"Mexico, end of the XIX Century,a rich owner of a big ranch refuses to accept the love between his daughter Maria de los Angeles and Carlos. As a result the young lady enters a convent to became a nun. Young Carlos is accused of a crime he didn't commit, cause the killer is his brother Felipe. Carlos escapes to the mountain where he becomes generous bandit calls El Diablo. Felipe dies and Carlos takes María de los Angeles out of the convent, but they are followed by the rural police and gunned down. She dies in Carlos' arms.",Spanish,Western
2107836,Mauvaise graine,"In the 30's, in Paris, the playboy Henri Pasquier is supported by his father, Dr. Pasquier with money and a brandy new car. When Dr. Pasquier decides to suspend the allowance and sell the car to force Henri to get a job, he leaves home and associates to a gang of car thieves. Henri falls in love for the thief Jeannette, and when they are betrayed by their boss, they decide to move to Casablanca and straight their lives.",French,Drama
2230264,Rai Story: From Cheikha Rimitti to Cheba Djenet,"Filmmakers Madeleine Verschaffelt and Ahmed Rachedi take us on a musical journey with RAI STORY, starting in the Algerian city of Oran, where the rai musical tradition began. In 1923, the first rai singers performed from behind screens at weddings and festivals so that their identity would be protected. It was only when the music of rai singer Cheikha Remitti began to gain popularity with the masses that the music was brought into the open, beginning with Remitti's first public performance in 1940. While on their quest to interview the legendary Cheikha Remitti, the filmmakers meet with singers such as Bouthelja Belkacem, Cheba Dalila and Cheba Djenet. They trace the transformation of rai music through the 1960s, '70s, '80s and '90s, exploring the careers of the musicians that have helped to keep this musical tradition alive. Although rai has been adapted for each new generation, its popularity has remained constant. It is not the pop music of today, but the sweet voices of rai you can hear spilling from the streets, shops and cafes of Oran.",Arabic,Documentary
2413211,The Silent Voice,"Franklyn Starr, a talented and wealthy young musician, suffers a double misfortune in the sudden loss of his hearing and in the death of his Mother to whom he is deeply attached. He loses his generous, joyous nature and transforms into a gloomy and despondent misanthrope. Sensitive about his deafness, he retires to an isolated home in the country, his sole companion being his faithful servant, and lives the life of a hermit. Wandering in the woods, he is unable to hear the workmen's warning cries and is injured in an explosion, Marjorie Blair, a young society woman, riding nearby, comes to his rescue and aid. Upon his recovery, he and Marjorie have fallen in love and are married. Just when their future looks the brightest, Bobby Delorme, a relative of Starr's, takes advantage of a past innocent flirtation with Marjorie, and creates a situation in which Starr believes that Marjorie has been unfaithful to him. He again becomes embittered.",English,Drama
2307865,Spring Madness,A young college man and his best friend both vie for the affections of the same woman while on their Spring Break vacation.,English,Comedy
2082002,Looker,"Plastic surgeon Larry Roberts performs a series of minor alterations on a group of models who are seeking perfection. The operations are a resounding success. But when someone starts killing his beautiful patients, Dr. Roberts becomes suspicious and starts investigating. What he uncovers are the mysterious - and perhaps murderous - activities of a high-tech computer company called Digital Matrix.",English,Drama
2089965,Lullaby,Lullaby is story of Bobby an 11 year old surviving in the cruel and unforgiving underbelly of London. Bobby's day is spent couriering drugs around for his Mum's boyfriend. His Dad's grave is his only escape from his life. Until a tragic accident offers Bobby a chance of redemption.,English,Crime
2137388,My Big Red Purse,"Director Giancarlo Iannotta sits down with his mother Pam to reminisce about a particular childhood memory from the 1960s. Pam recalls her, her best friend, and a big red purse going up against the neighborhood bully, refusing to back down.",English,Short
2471097,Utazás Jakabbal,"István and Jakab are fire-extinguisher experts. They travel the country to check fire-extinguishers at country factories. During their tours of inspection they chase women, drink in dirty pubs and live in clover.",Hungarian,Drama
1709453,Baekman jangjaga doeryeonmyeon,"King Yama, the Lord of the Heavens, accidentally collects the wrong soul. He mistakenly calls good Kim Chang-jin before his time to die has come. To make up for this error, Yama places the soul into the body of a recently deceased millionaire",Korean,Comedy
2367555,The Fan,"Lord Windermere appears to all -including to his young wife Margaret - as the perfect husband. But their happy marriage is placed at risk when Lord Windermere starts spending his afternoons with an adventuress who is working her way through London's high society, Mrs. Erlynne. Worse, Windermere gives her big sums of money. To crown it all he asks his wife to invite the detestable woman to her own birthday party. Upset and outraged, the puritan Lady Windermere decides to leave her husband and goes to Lord Robert Darlington, who has been courting her for some time. Unfortunately she leaves her fan -the one Robert offered her for her birthday - in Robert's house...",English,Comedy
1691503,Anxious for Love,"The anxiety-ridden experience of not feeling confident in one's own ability to entice the opposite sex. Although the prospect of going on a blind date makes him more anxious than he would care to admit, Oliver, nonetheless, agrees to go along with it. His string of bad luck with women is long and he's ready to try anything to find love. He's prepped properly: a new haircut, a snazzy shirt and an impressive floral bouquet. He's sporting a positive attitude and ready to try it all again. But is it enough to overcome the onslaught of humiliation, intimidation and rejection that is waiting for him at his faceless rendezvous of love?",English,Comedy
2307726,Spriggan,"Yu is a young man who has a past he desperately wants to forget. His present is that he is a superhuman top agent for Arcan, an organization dedicated to protecting ancient artifacts to prevent them from falling into the wrong hands. However, he receives several bloody messages, culminating in the suicide of a friend, telling that Noah would be his death. In response, Yu travels to Turkey to visit the Arcan dig at Mount Arrat, where Noah's Ark is supposed to have rested. Along the way there and at the destination, he learns of forces of his past have returned to stop him and sieze control of the Ark, which turns out to be an alien device of ultimate power.",Japanese,Adventure
1764751,Cell,"Life is for the birds. They require so little. Every day gathering their lives from the wind. Doron has no wind. If only he could harness the voice of every bird, every jay, every sparrow. Could he funnel their song inside his soul? Could he survive another day? An enigmatic story about a man's relationship with his surroundings both natural and artificial.",English,Horror
1734630,Blind Mice,"In the small Auckland drug scene, a young woman, Jules, finds her life complicated by an unwanted pregnancy. By oscillating between two drug dealers; a younger buyer, Ollie, and her older lover and supplier, Chase, she looks for a male figure to support her.",English,Drama
2165180,O diaheiristis,"A gently ironic portrait of a midlife crisis. Pavlos takes over the job of building manager just as a sewage pipe bursts. Will Pavlos succeed in fixing the broken sewage pipe before he can fix his own wrecked life? Director Hoursoglou succeeds in creating a faithful, entertaining, and even touching portrait of \ordinary\"" interpersonal relations.""",Greek,Drama
