movie_id,title,plot,language,genre
2456917,Two Weeks,"Two weeks off perhaps? Break free with Johnny Abegg, from a monotonous world of ideals and unhappiness, to experience the harsh and remote wilderness of Tasmania on his own, to find out who he really is. The decision takes Johnny on an inward journey, to a place of reflection, accountability and deep self inquiry; facing a hidden 'dark side' alone, within the unforgiving landscape. Through the internal battle of opposites, amplified by the humbling surrounds; Abegg is stripped back to the basic creature that he is, to find a moment of clarity amidst the endless questions... So is there an answer? A right way to live? Find out for yourself. Just surrender.",English,Adventure
1982258,In Venice,"The Venetian canals are filled with all sorts of odd Terrytoon mice and hippos and dogs in unusual versions of gondola boats. Our hero is a Puddy/little boy-like character who happens to be a Facisti soldier, marching along with his black-shirted regiment to a great ceremony. The great aviation pioneer Italo Balbo(1896-1940) is arriving, but he's apparently such a remarkable flier he needs no plane- he just extends his arms like wings! A huge limousine with Fascist emblems pulls up, and we expect Il Duce to step out, but instead, inexplicably, it's all-American Will Rogers(1879-1935)who then puts a medal on Balbo. Then we move to the more typical precincts of Terrytoondom, a giant spidery octopus nabs a girl from her Gondola and our hero dives in the Po after them. The Octopus pad is the scene of the usual operatics and heroics and soon she is rescued, and the romance of Venice is restored.",English,Animation
2454662,Tutti defunti... tranne i morti,"Dante trova un lavoro: vendere per conto dell'autore le copie di un libro che parla di una serie di famiglie nobili alle famiglie citate nel libro. Non trova nessuno, poi finalmente alla villa dei marchesi Zanotti gli viene aperto. Ignazio, il marchese, è appena morto e la casa è piena di parenti. La figlia Ilaria si innamora a prima vista di Dante e lo invita a cena. Nel frattempo l'autore del libro viene ucciso e i libri bruciati e nella villa si hanno due omicidi. Viene così chiamato l'investigatore privato Martini che come prima misura chiude tutti dentro la villa bloccando le uscite. Ma gli omicidi continuano mentre la villa resta isolata.",Italian,Comedy
1650711,A három növér,"In a small Russian town at the turn of the century, three sisters (Olga, Irina, and Masha) and their brother Andrei live but dream daily of their return to their former home in Moscow, where life is charming and stimulating meaningful. But for now they exist in a malaise of dissatisfaction. Soldiers from the local military post provide them some companionship and society, but nothing can suffice to replace Moscow in their hopes. Andrei marries a provincial girl, Natasha, and begins to settle into a life of much less meaning than he had hoped. Natasha begins to run the family her way. Masha, though married, yearns for the sophisticated life and begins a dalliance with Vershinin, an army officer with a sick and suicidal wife. Even Irina, the freshest, most optimistic of the sisters, begins to waver in her dreams until, finally, tragedy strikes.",Hungarian,Comedy
2000174,Jian nu,"During a period of upheaval, an itinerant performer has a troupe of four children, one of whom is his daughter Mu-Lin. Jump ahead 15 years, he's ready to retire and has arranged Mu-Lin's marriage. Someone he recognizes enters his house and murders him. Mu-Lin is brought to a fancy bordello where the most beautiful prostitute, Yeh Hong, takes a special interest in her. One of Yeh Hong's lovers, Kim, who is an assassin, also develops a relationship with Mu-Lin. He and Yeh Hong may be working with the emperor's eunuch; all are power hungry. Things seem more than coincidental: does Mu-Lin have a history with this trio? If so, what is it?",Taiwanese,Action
1956726,Hong fen,"The film charts the fortunes of two women who loved each other as sisters, but whose paths diverge when the Revolution brings an end to their old way of life in the brothel.",Cantonese,Drama
1873197,Eskapade,"Miss Mueller, a Polish patriot, employed as a secret agent, is seeking some means of making a safe entry into Czarist Russia in order to help her imprisoned friends. She meets a traveling American, Georg Alexander, and asks his aid to get her into Russia. He allows her to travel on his passport as his wife but after they cross the border she is spotted by Russian agent Walter Franck. Complications follow but she eventually achieves an audience with the carefully-guarded Grand Duke and he promises clemency for her compatriots. She and Alexander return to Poland with the intention of making their fake-marriage a real one.",German,Comedy
1767278,Channel News,"Two estranged, 20-something siblings, find themselves living together once again in their parent's Minnesota home, where they discover home movies they used to make together as kids. After watching their old James Bond spoofs, talk shows, and Saturday Night Live sketches, they are inspired to make 'The Sarah and Beau Show', a talk/variety show for the Internet.",English,Comedy
2288232,Silver City Kid,"Molybdenum deposits can make a man rich, but Stoner finds that the deposits run under the Clayton Ranch. Judge Ballard wants the Ranch so he has Garvey shoot Steve. When Ruth blames Stoner for the death of Steve, Ballard shoots Stoner and puts the blame on Ruth, who is holding the gun. This way, Ballard has no partners. While Garvey tries to shoot Jack over and over, Jack is looking for evidence to clear Ruth and convict Ballard.",English,Crime
2398011,The Nothing Men,"Panic and intrigue grip the lives of a group of hardened factory workers with the arrival of a man they fear is a head-office spy sent to rob them of their redundancy payouts. The ruthless baiting between top dog Jack and his men only intensifies when the pacifist of the group, Wesley, befriends the seemingly normal outsider, David. But when Wesley discovers David is hiding a much darker secret, the seeds are planted for an explosive finale that strikes like an emotional sledgehammer and seal the fate of The Nothing Men.",English,Drama
2516606,Yôkai hantâ: Hiruko,"A school was built on one of the Gates of Hell, behind which hordes of demons await the moment they will be free to roam the Earth. Hiruko is a goblin sent to Earth on a reconnaissance mission. He beheads students in order to assemble their heads on the demons' spider-like bodies. Hieda, an archaeology professor, and Masao, a haunted student, investigate the gory deaths and eventually battle Hiruko.",Japanese,Comedy
2108139,Max Payne,"Three years ago, NYPD detective Max Payne's wife and baby were murdered. Max gets himself transferred to the cold case office where he can continue searching for the killer who got away. He's a loner, but two people reach out to him during a fateful week: Alex, his ex-partner who may have found a clue, and BB, the security chief at the pharmaceutical company where Max's wife worked. Meanwhile, bodies are piling up, some as a result of a drug on the street that is highly addictive and, for many who take it, brings hideous hallucinations. When one of the bodies is a woman Payne was the last to see alive, her sister comes looking for him armed to the teeth; Max must move fast.",English,Action
1686237,Anche per Django le carogne hanno un prezzo,Django's fiancee was abducted. So he must rescue her but that's not very easy. The problem is that the kidnappers are the Cortez brothers and their gang. They have robbed a bank and hid in a cave. Django chase them with the help from an American and Fulton. Fulton is a agent who is employed the bring the gold back to the bank.,Italian,Action
1716667,Be Home Soon: Letters from My Grandfather,"A documentary about war and faith, love and loss, family myth and legacy - based on family letters from the patriarch who volunteered as a Chaplain in WWII in the Philippines, survived the Bataan Death March and died as a Japanese Prisoner of War. More poem than biopic or World War II documentary, Be Home Soon is a beautifully told and gorgeous lyrical testament which touches a universal nerve in its exploration of war and devotion - a meditation in motion on grace, memory and healing. Using letters, archival footage and stills, animation and present day footage, the film is poignant, thought-provoking and historically informative.",English,Biography
2227816,Questa volta ti faccio ricco!,"Joe Esposito, an italo-american, and Brad McCoy, a Scottish man, are engaged by Giorgiakis to be his bodyguards, due to their physical stature, and muscular development. Only, on the cover, both men are dealing in drugs... Wang and his gang get interested in a particular big cache of drugs, and therefore Giorgiakis, and his bodyguards, will find themselves under unexpected pressure.",Italian,Action
2160517,Not Again!,"Angie, a befuddled young woman, cannot seem to end a hectic day, when she's confronted by her ex, Jamie. Whisked about town on a whirlwind date, Jamie falls for Angie again, but she resists. Unfortunately, her roommate, Rita, does not and falls for Jamie anyway. It all explodes at a party attended by all and with the additions of ex girls and guys everywhere.",English,Comedy
1756761,Cameriera bella presenza offresi...,"Maria is a housmaid and she is being engaged to Berto for fifteen years. Berto has not a lasting job so he is waiting for the death of his uncle Matteo to come into an inheritance. In the meantime Maria goes on with her work, first in the house of an unfaithful wife; then for an actor and his wife on the verge of leaving each other and last for Raffaele who wants to marry her. At last uncle Matteo dies...",Italian,Comedy
2391996,The Man Within,"Told in flashback, the film opens on a brutal scene of a 17-year-old boy, Francis Andrews, being brutally lashed during a police interrogation in which the boy thinks back to the past that placed him in this situation. He betrayed the crew of a smuggling ship whose master, Richard Carlyon, was also his guardian. Some of the smugglers are caught, but Carlyon escapes and then begins his search for Andrews. Carlyon was quiet fond of the boy but knew him for a coward. Andrews seeks refuge in in the cottage of a girl named Elizabeth, who urges him to give testimony against the smugglers in court. He summons his courage and does so. Carlyon, catching up with Andrews, recognizes this as an act of courage, and does not take revenge on him. Carlyon is eventually caught, but despite the police torture, Andrews does not identify him, and he goes free while his guardian faces the gallows. (The original-British-released version runs about 20 minutes longer than the \default\"" ---actually USA--- time shown on site.)""",English,Adventure
2369476,The Flame and the Arrow,"Twelfth-century Lombardy lies under the iron heel of German overlord Count Ulrich 'The Hawk', but in the mountains, guerillas yet resist. Five years before our story, Ulrich stole away the pretty wife of young archer Dardo who, cynical rather than embittered, still has little interest in joining the rebels. But this changes when his son, too, is taken from him. The rest is lighthearted swashbuckling, plus romantic interludes with lovely hostage Anne.",English,Action
2316658,Street Wok'n,"Streetwok'n is a lightweight comedy about Uncle and Nephew, two Asian immigrants, who try to make it in an American ghetto. Uncle's breakthrough idea to sell Chinese food in vending machines makes an enemy of Power T, the self-proclaimed ghetto kingpin, who uses the machines to sell his drugs. Uncle and Nephew, with the help of Quentin St. James, their Jamaican friend, and Mr. Chin, their faithful dog, must fight Power T and his gang of Intimidators to succeed in their business. Will Nephew survive the local school system? Can the ghetto survive Power T and his terrible bass-busting rap music? Will Uncle divulge the secret of his special sauce? No one is safe, including Uncle Sam, in this non-stop, laugh-filled satire of all things American.",English,Comedy
2366187,The Europa Society,"In a small town in northern Michigan, there is a small group of people who meet every month to talk about populating a small moon orbiting Jupiter, Europa. Lead by a really, really important former Apollo mission technician, The Europa Society is not one of those crackpot, crazy clubs of people just deluding themselves into believing they can do something that is impossible. Although that does describe their crosstown rivals, The Callisto Club. With the beautiful orange glow from Jupiter and its vast ocean beneath the thick layer of ice, Europa is one of the few places in our solar system with all the resources to sustain life. And with a target mission date of 2050, there is a lot of time to prepare. I mean, you can't just up and go 400 million miles without preparation. Now that would be crazy.",English,Comedy
2338212,Tender Flesh,"A stripper and her sleazy boyfriend are invited by a wealthy woman and her lover to join them on her private island for a weekend of sex games in exchange for a large fee. When the couple gets there, however, they are captured, then let loose on the island to be hunted down and killed.",Spanish,Comedy
2385360,The Last Word,A journalist with solid mob connections falls for a stripper with a dark past. His best friend then drags him to L.A. with the intent of becoming movie men. But does real life and fiction really go together?,English,Crime
2464599,Under Arizona Skies,"Dusty Smith arrives and takes a job on a ranch that is losing cattle to rustlers. When the rustlers strike again the cattle cannot be found but Dusty shoots one of the rustlers. Arrested for murder, Dusty is broken out of jail and the real outlaws put in the cell. Dusty then has them released figuring they will lead him to the hideout and the missing cattle.",English,Western
2443918,Torowisko,"Using the backdrop of the banality and ordinariness of everyday life in a small provincial town, the film analyses the relationship between two women friends, who struggle to find their way in post-communist Poland. The small events of their lives represent universal feelings of being trapped and lost in a new world, in contrast to the successes of the dark side of democracy - drug dealing, crime and pornography. By its very nature, the film creates a picture of provincial Poland after democracy, but its charm is in the understated relationship between the two friends and the people around them and in the mosaic structure that builds up the film piece by piece.",Polish,Drama
1802293,Danger on Wheels,"During a test a race car using an experimental oil-fueled engine blows up, killing the driver. Lucky Taylor, a stunt driver, is initially blamed for the accident, but is later cleared. He thinks the engine design has a real chance to win races, but the racing association has banned it since the accident. He devises a scheme to have a car equipped with the engine entered into a race, without race officials--or the engine designer's sassy daughter--finding out about it.",English,Sport
2356372,The Churning of Misty Whistle,"A beloved spokes-model for a famous brand of margarine has a career-ending accident that disfigures her face permanently. The public disdain and her personal despair at the rejection, transforms her into a homicidal maniac with a very specific victim in mind.",English,Comedy
2354649,The Care Bears Adventure in Wonderland,"The cuddly Care Bears star in this charming feature-length adaption of the classic story of Alice in Wonderland. A young girl named Alice and the Care Bears travel together into the whimsical land of the Mad Hatter and the March Hare. In this magical story about friendship and trust, Alice and the Care Bears try to thwart an evil wizard's attempt to become the King of Wonderland.",English,Animation
2351325,The Bold Bank Robbery,"Three well-dressed men are taken by a servant to a home where they change clothes. The four of them summon a car, and after being driven a short ways, they overpower the driver and leave him bound and unconscious by the roadside. They proceed to rob a bank vault and then try to make their escape, with police pursuing them across the city.",English,Crime
1669379,Agnes Cecilia - En sällsam historia,"Nora is 15 years old. Her parents died when she was young and now she lives with Anders and Karin and their son Dag. They move into an old apartment in an old house in Enköping. Behind a wall they find some old items from people who lived there a long time ago. They also discover that their apartment is haunted by a ghost. Together with Dag, Nora tries to find out more about the people who lived there.",Swedish,Mystery
2472226,Vagrant,"After a daring daylight bank robbery, a band of gun-toting thugs hole up in an abandoned house in the slums of the city in hopes of evading the police. Along with an innocent young schoolgirl they have taken hostage, the gang waits through the night for their chance to abscond with the cash and skip town. But little do they know that a deranged, drug-addled vagrant lives in the attic. He wants the money for himself and will stop at nothing to get it.",English,Horror
1801631,Dance Hall Hostess,"Nora Marsh, a dance-hall hostess, marries a rich mama's-boy boozer, Patrick Gibbs, although she really loves another man, Jerry Raymond, who is serving jail-time for bootlegging. Raymond is released from jail and, shortly afterward, Nora's alcoholic husband turns up dead, under suspicious circumstances. The sheriff suspects Nora and Raymond killed Gibbs.",English,Crime
2172658,Omaret yakobean,"Cairo: a 70-year-old building of once-luxury flats with tenements on the roof. Zika, an aging libertine, feuds with his sister. Pius Haj Azzam takes a second wife, in secret, to satisfy sexual drive within religious bounds. Bothayna, poor and beautiful, supports her family, wanting to do so with dignity intact. Her former fiancé, Taha, the janitor's son, humiliated by the police, turns to fundamentalism. Hatem, a gay editor, seduces and corrupts a young man from the sticks. Two brothers, Copts, one a tailor and one Zika's factotum, connive for property. Allah is on most everyone's lips, and corruption is in their hearts. European values, both refined and worldly, provide a subtext.",Arabic,Drama
1835562,Distance,"Everything about 'Distance' started from my own experience. It's about me, my brother and my father. The relationship between my brother and my father has been always terrible. They never communicated and the worst part of them was that they never ever tried to understand each other. I wanted to talk about this in a slight humorous way. From the start of the movie, the father and the son do not understand each others sentiments while they are watching television. The father have a hard time figuring out why his son is laughing and the son finds really weird why his father is crying for. However, at the very end of the film, they find something that interests both of them together and start to gather up better.",English,Comedy
2148678,Negative Space,"How do we treat the people that we love? What secrets do we keep from them, and why? What happens when these secrets come out? When a married couple gets an unannounced visit from the wife's younger sister, deep, and unexpected, issues boil to the surface and threaten to upend and destroy even the closest relationships.",English,Drama
1967105,I Dreamed I Searched for You in Heaven,"A documentary based upon the lives of outsider folk artists, Ronald and Jessie Cooper. Ronald and Jessie became artists in their mid-fifties while living on disability after having lost their Kentucky country store, enduring multiple heart attacks, and being seriously injured in an automobile accident. The story is told through the voices of their four children as well as pioneers of the Kentucky Folk Art Center in Morehead, KY who gave the Coopers their start. The film is an account of their life tragedies and triumphs based upon the messages told throughout their artwork.",English,Documentary
2218066,Prison Farm,"Disregarding the advice if her friends and against her own better judgment, working girl Jean Forest keeps company with Larry Harrison, a small-time hoodlum, helps him out of jams he gets in and even shares her money with him. When he suggests they elope to Canada, she gives up her job, not knowing that he has just committed a holdup in which a man has been killed. On the way, they are arrested for a minor offense and Harrison, hoping to hide out on the local prison farm, pleads guilty and both are sent there. The local prison farm turns out to be a backward and brutal penal colony, and the only person in the camp that Jean can turn to for help is Roi Conrad, the camp doctor who is crusading for reforms at the farm-camp.",English,Adventure
1896831,Fool's Gold,"A young man and woman sit down for a cup of coffee. They're in their twenties and have been friends since junior high school. She's been studying abroad for the last several years while he's been living in the basement of his parent's house in the same suburban community in which they grew up. When a lull in the conversation sets in, the young man decides it's the opportune time to reveal how he truly feels about her. His initial optimism that she may share his feelings slowly dissipates as the young woman attempts to let him down gently - though only after collecting all the compliments he has to offer. The young man compounds the problem by making a clumsy attempt to save face which contributes to their friendship being left in ruins.",English,Comedy
1928191,Green Zone,"Following the American invasion of Iraq in 2003 Chief Warrant Officer Roy Miller and his men are charged with finding the so-called weapons of mass destruction, whose existence justified American involvement, according to the Pentagon and their man in Baghdad, Poundstone. Veteran CIA operative Marty tells Miller that there are no weapons, it is a deception to allow the Americans to take over the country and install a puppet leader. Also suspicious of Poundstone is Wall Street Journal reporter Lawrie Dayne, who lets slip to Miller that Poundstone told her he had secret talks in Jordan with an important Iraqi, code-named Magellan, who told him about the weapons, though it now seems likely Magellan's true information was to the contrary. So begins a hunt for the truth. Who's playing whom?",English,Action
2042147,La legge è legge,Assola is an imaginary village on the border between Italy and France and the borderline crosses the village itself. The French customs agent Ferdinand is always trying to catch the Italian smuggler Giuseppe. Giuseppe discovers that Ferdinand was actually born in Italy and therefore he can't be a French customs agent.,French,Comedy
1809777,De lo imperdonable,"A rainy afternoon Ernesto realized that the rain doesn't fall over his body. I't could be a fantastic anecdote for that day, just like Martha and her UFO's. Except that for Ernesto, this would become a secret kept for years. Just like a secret kept by those who understand that only inside yourself hides the truth.",Spanish,Fantasy
2111882,Melancholic Sabbat,"Under the black moon, the Sleeping Beauty became the fallen angel fallen from the sky. Under the black moon, there's the metamorphosis, the desire prisoner to run in circles. Halfway between the kingdom of the dead and the living, there is sacrifice.",French,Fantasy
2448572,Tre piger fra Jylland,"Three girls (around 20 years old) who have grown up in different parts of Denmark get a strange letter. It turns out they are sisters, and will inherit from their late mother, if the can stay together one month in the same house. They end up in a lot of (romantic) trouble, because of speculations of who their father(s) might be.",Danish,Comedy
2508785,Xenoa,"The ruler of Xenoa, Queen La'ian, gives birth to the heirs of her throne: Eli, Zeus, and Drix. She decides to protect her triplets from the scheming leader of rival world Zephyr, General Norak, by sending her children to faraway Earth. Two decades later, the lives of the three estranged siblings intersect in the most unexpected way. Everything they know and love is suddenly threatened when General Norak zeroes in on them from light years away. The spiteful alien wants unconditional, uncontested power over Xenoa, but he is unable to achieve this as long as the true heirs to the throne are still alive. He is so hellbent on ruling Xenoa that he doesn't think twice about turning sibling against sibling in his quest for power.",Filipino,Action
1787141,Constantine,"John Constantine is approached by Det. Angela Dodson who needs his help to prove that her twin sister Isabel's death was not a suicide. The dead woman was a devout Catholic and Angela refuses to accept that she would have taken her own life. She's asked Constantine for help because he has a reputation for dealing with the mystical. In fact, he is a demon hunter whose sole purpose on Earth is to send demons back to the nether regions. John himself has been to Hell - as a young man he too committed suicide and now knows that he is destined to return there on his death - but hopes that his good deeds may somehow find him a place in Heaven. As he looks into Isabel's death, he realizes that demons are trying to break through to the human world and his battles lead him into a direct conflict with Satan.",English,Fantasy
